name,city,date,type,description
Tech Summit 2025,New York,2025-06-15,Conference,A summit for tech enthusiasts.
Music Fest 2025,Berlin,2025-07-20,Concert,An annual music festival.
AI Workshop,Tokyo,2025-08-10,Workshop,Learn about AI advancements.
Cyber Expo 2025,London,2025-09-05,Exhibition,Explore the latest in cybersecurity.
Future Tech Hackathon,San Francisco,2025-10-12,Hackathon,Innovate and build future tech solutions.
Neon Dance Party,Miami,2025-11-20,Party,A vibrant dance party with neon lights.
Space Exploration Seminar,Houston,2025-12-01,Seminar,Dive into the future of space travel.
Virtual Reality Summit,Seoul,2025-12-15,Conference,Experience the latest in VR technology.
